year,event_name,description
1982,The Wall reaches Soviet viewers through informal circulation,The film version of Pink Floyd's The Wall reached Soviet viewers through informal circulation. Its imagery of pressure and isolation intensified the appeal of dark conceptual rock among young listeners.
1982,Yuri Andropov succeeds Brezhnev,"Yuri Andropov came to power after Brezhnev's death and signaled a sterner, more disciplined public mood. This narrowed the range of acceptable themes and pushed musical expression toward coded bitterness, tension, or self-censorship."
1982,Luzhniki disaster in Moscow,"A crowd crush at Moscow's Luzhniki Stadium in 1982 became one of the late Soviet era's most traumatic sports disasters. This encouraged more mournful and reflective tones and made fragile, grief-struck songs feel more immediate."
1982,Compact disc reaches the consumer market,"The compact disc reached the consumer market. Although it arrived slowly in the USSR, it symbolized cleaner sound and a more future-oriented listening culture."
1982,Cats becomes a global musical theatre sensation,Cats became a global musical theatre sensation. Its success reinforced the idea that large-scale musical spectacle could command mass emotion across borders.
1982,Michael Jackson releases Thriller,"Michael Jackson released Thriller. Its precision and spectacle reset global pop standards, including what Soviet listeners expected from mass entertainment."
1982,Falklands War dominates headlines,The Falklands War dominated global headlines. The conflict reinforced militarized media feeling and made music with tension and bravado more resonant.
1982,The Soviet film We Are from Jazz succeeds,"The Soviet film We Are from Jazz became a notable success. By legitimizing jazz in popular cinema, it widened the public emotional space for playfulness and swing."
1983,Able Archer crisis,"The Able Archer military exercise triggered a major East-West crisis. This deepened social stress and economic insecurity, often favoring bleak, ironic, and survival-oriented moods in music."
1983,Bravo is founded in Moscow,"The band Bravo was founded in Moscow in 1983. This gave musicians more room to experiment and strengthened hopeful, searching, and forward-looking moods."
1983,Rock clubs and semi-legal concert circuits expand in the USSR,"Rock clubs and semi-legal concert circuits continued to expand in Soviet cities during the early 1980s. This gave musicians more room to experiment and strengthened hopeful, searching, and forward-looking moods."
1983,KAL 007 is shot down,"The Soviet downing of Korean Air Lines Flight 007 triggered a severe international crisis in 1983. This intensified anxious, tense, and vulnerable moods around cultural life and listening."
1983,Anti-rock pressure hardens around unofficial concerts,"Pressure around unauthorized rock concerts and underground circulation hardened in several Soviet cities in 1983. This narrowed the range of acceptable themes and pushed musical expression toward coded bitterness, tension, or self-censorship."
1983,Eurythmics release Sweet Dreams (Are Made of This),Eurythmics released Sweet Dreams (Are Made of This). Its cool synthetic tension helped define a colder and more controlled emotional style in 1980s pop.
1983,The Day After spreads nuclear anxiety on television,"The television film The Day After spread nuclear anxiety across many countries. Its imagery made apocalypse feel emotionally near and strengthened the pull of dark, tense music."
1983,The film We Are from Jazz becomes a youth touchstone,The film We Are from Jazz became a youth touchstone across the USSR. Its warmth and wit offered a rare mainstream space for lighter and freer musical feeling.
1983,Michael Jackson unveils the moonwalk,Michael Jackson's televised moonwalk became a global pop sensation. It pushed performance toward sharper visual charisma and raised expectations for excitement in music culture.
1983,Yuri Andropov hardens labor discipline,The Andropov leadership hardened labor discipline and public controls. That stricter atmosphere made informal musical spaces feel more emotionally necessary as outlets.
1984,Growth of officially tolerated rock activity under late socialism,"By the mid-1980s, some rock activity had become more visible through clubs, festivals and semi-official venues. This reshaped commercial incentives and nudged artists toward sounds that matched newly visible audiences and emotions."
1984,"Kino releases ""Nachalnik Kamchatki""","The band Kino released the album ""Nachalnik Kamchatki"" in 1984. This gave Soviet and Russian listeners a fresh emotional model, and its sound spread through broadcasts, imports, and home copying."
1984,Bruce Springsteen releases Born in the U.S.A.,Bruce Springsteen released Born in the U.S.A. Its mixture of anthem-sized energy and buried bitterness gave mass rock a more ambivalent emotional model.
1984,USSR boycotts Los Angeles Olympics,"The USSR and several allies boycotted the Los Angeles Olympics. This amplified shared cultural energy and rewarded brighter, bigger, and more communal musical moods."
1984,Deaths of Andropov and rise of Chernenko,"The quick succession from Andropov to Chernenko reinforced the sense of exhaustion in late Soviet leadership. This deepened social stress and economic insecurity, often favoring bleak, ironic, and survival-oriented moods in music."
1984,Madonna releases Like a Virgin,Madonna released Like a Virgin. Its bright provocation pushed pop toward more assertive image-making and emotionally direct hooks.
1984,Band Aid releases Do They Know It's Christmas,Band Aid released Do They Know It's Christmas. The single made pop music feel newly collective and compassionate on a global scale.
1984,Prince releases Purple Rain,"Prince released Purple Rain. Its blend of drama, sensuality, and grandeur broadened the emotional ambition of pop heard through Soviet informal channels."
1984,Wham! becomes a major Soviet bootleg favorite,Wham! became a major bootleg favorite among Soviet listeners. Their upbeat gloss gave youth culture a brighter and more carefree emotional fantasy amid stagnation.
1984,Tetris is created in Moscow,"Alexey Pajitnov created Tetris in Moscow. Its emergence hinted that Soviet creativity could still generate fresh, modern forms, feeding a quieter optimism."
1985,"Kino releases ""Noch""","The band Kino released the album ""Noch"" in 1985. This gave Soviet and Russian listeners a fresh emotional model, and its sound spread through broadcasts, imports, and home copying."
1985,Live Aid,"The Live Aid concerts were held. This amplified shared cultural energy and rewarded brighter, bigger, and more communal musical moods."
1985,Spread of more open rock coverage in Soviet media,"Coverage of rock music became somewhat broader in Soviet media during the second half of the 1980s. This gave musicians more room to experiment and strengthened hopeful, searching, and forward-looking moods."
1985,Mikhail Gorbachev comes to power,"Mikhail Gorbachev became Soviet leader in 1985 and soon changed the tone of public life. This gave musicians more room to experiment and strengthened hopeful, searching, and forward-looking moods."
1985,Anti-alcohol campaign begins,"Gorbachev's anti-alcohol campaign began in 1985 and immediately affected everyday leisure and nightlife. This narrowed the range of acceptable themes and pushed musical expression toward coded bitterness, tension, or self-censorship."
1985,Glasnost enters official political language,Glasnost entered official political language under Mikhail Gorbachev. The promise of greater openness made listeners expect more honest lyrics and a wider emotional range in song.
1985,Dire Straits releases Brothers in Arms,"Dire Straits released Brothers in Arms. Its clean, spacious sound and antiwar undertone gave Soviet listeners a polished form of reflective rock."
1985,Artists Against Apartheid release Sun City,Artists Against Apartheid released Sun City. The project tied pop more openly to moral protest and sharpened the ethical charge of music.
1985,Geneva summit restarts high-level Soviet-American dialogue,The Geneva summit restarted high-level Soviet-American dialogue. The thawing tone made outward-looking and hopeful moods feel more possible in popular culture.
1985,Boris Yeltsin rises in Moscow politics,Boris Yeltsin rose quickly in Moscow politics. His blunt public style foreshadowed a rougher and more confrontational emotional climate.
1986,Chernobyl Disaster,"The Chernobyl disaster occurred. This encouraged more mournful and reflective tones and made fragile, grief-struck songs feel more immediate."
1986,Expansion of official festival space for Soviet rock,"Official and semi-official festival space for Soviet rock expanded further in 1986. This amplified shared cultural energy and rewarded brighter, bigger, and more communal musical moods."
1986,Laskovyi May is formed,The group Laskovyi May was formed in Orenburg in 1986. This reshaped commercial incentives and nudged artists toward sounds that matched newly visible audiences and emotions.
1986,Wider circulation of rock on Soviet television and radio,Rock music began to appear more often on Soviet television and radio during the second half of the 1980s. This reshaped commercial incentives and nudged artists toward sounds that matched newly visible audiences and emotions.
1986,Reykjavik summit deepens the sense of thaw,"The Reykjavik summit between Gorbachev and Reagan deepened the international sense that the Cold War might be softening. This gave musicians more room to experiment and strengthened hopeful, searching, and forward-looking moods."
1986,27th Congress endorses perestroika,The 27th Congress of the CPSU formally endorsed perestroika. That gave reformist energy an official stamp and encouraged more expectation in artistic life.
1986,Mir space station is launched,The Mir space station was launched. Its futuristic symbolism supported moods of technological hope at a time when society otherwise felt strained.
1986,Moscow hosts the Goodwill Games,Moscow hosted the Goodwill Games. The event briefly widened cultural openness and made international pop feeling more visible and aspirational.
1986,Red Wave presents Soviet rock abroad,The Red Wave compilation introduced Soviet underground rock to Western listeners. That recognition encouraged local musicians to imagine a larger emotional and artistic horizon.
1986,Kin-dza-dza! becomes a cult dystopian reference,The film Kin-dza-dza! became a cult reference across the USSR. Its absurd bleakness fed the taste for irony and alienation in late-Soviet cultural mood.
1987,Broader public release of Soviet rock records,"Soviet rock acts gained broader access to official recording and mass circulation during 1987. This gave Soviet and Russian listeners a fresh emotional model, and its sound spread through broadcasts, imports, and home copying."
1987,Expansion of artistic freedom during glasnost,Artistic freedom expanded during glasnost. This reshaped commercial incentives and nudged artists toward sounds that matched newly visible audiences and emotions.
1987,Podolsk rock festival,"The large multi-day Podolsk rock festival was held near Moscow in 1987. This amplified shared cultural energy and rewarded brighter, bigger, and more communal musical moods."
1987,Mathias Rust lands near Red Square,"West German teenager Mathias Rust landed near Red Square in 1987 and stunned the Soviet public and leadership. This deepened social stress and economic insecurity, often favoring bleak, ironic, and survival-oriented moods in music."
1987,Law on cooperatives signals a new economy,"The law on cooperatives signaled a new opening for semi-private economic activity in the USSR in 1987. This gave musicians more room to experiment and strengthened hopeful, searching, and forward-looking moods."
1987,INF Treaty is signed,The USSR and the United States signed the INF Treaty. The reduction of nuclear tension made future-oriented and hopeful moods more believable in culture.
1987,Boris Yeltsin breaks publicly with the leadership,Boris Yeltsin's break with the Soviet leadership drew mass attention. His confrontation energized a more defiant and emotionally direct public tone that also touched music.
1987,Glasnost opens discussion of Stalinist terror,Glasnost opened wider public discussion of Stalinist terror. The new honesty pushed songs and performances toward heavier memory and moral seriousness.
1987,Depeche Mode's Music for the Masses becomes a Soviet cult record,Depeche Mode's Music for the Masses became a Soviet cult record through tapes and radio. Its sleek melancholy helped define the emotional grammar of urban youth listening.
1987,Global stock-market crash spreads anxiety,The 1987 stock-market crash spread global anxiety. The shock reinforced a sense of fragility and tension that made nervous musical moods feel timely.
1988,Kino Releases Gruppa Krovi,"Kino released Gruppa Krovi. This gave Soviet and Russian listeners a fresh emotional model, and its sound spread through broadcasts, imports, and home copying."
1988,NWA releases Straight Outta Compton,"NWA released Straight Outta Compton. This gave Soviet and Russian listeners a fresh emotional model, and its sound spread through broadcasts, imports, and home copying."
1988,Release of the film Assa,"The film Assa was released. This gave Soviet and Russian listeners a fresh emotional model, and its sound spread through broadcasts, imports, and home copying."
1988,Millennium of the Baptism of Rus is celebrated,"The millennium of the Baptism of Rus was publicly celebrated in 1988, widening the place of religion in late-Soviet culture. This sharpened questions of identity and belonging, making music more sensitive to symbolic loyalty and cultural division."
1988,Armenian earthquake shocks the USSR,"The 1988 Armenian earthquake shocked the Soviet Union and generated a huge wave of grief and solidarity. This encouraged more mournful and reflective tones and made fragile, grief-struck songs feel more immediate."
1988,19th Party Conference puts politics on live television,"The 19th Party Conference brought unusually open political debate to live television. The new public candor widened the emotional space for sharp, contemporary songwriting."
1988,USSR begins withdrawing from Afghanistan,"The USSR began withdrawing troops from Afghanistan. The move combined relief with grief and fatigue, deepening the attraction of reflective songs."
1988,Nagorno-Karabakh conflict turns openly violent,The Nagorno-Karabakh conflict turned openly violent. Its eruption darkened the late-Soviet atmosphere and made fear and loss more central public feelings.
1988,Depeche Mode becomes a mass Soviet cult,Depeche Mode's popularity surged further in the USSR through bootlegs and fan circles. Their controlled melancholy gave urban listeners a sophisticated emotional mirror for the time.
1988,Pirated music videos spread faster across the USSR,"Pirated music videos spread more rapidly across the USSR. The stronger visual component pushed pop toward mood, style, and image as much as melody."
1989,"Kino releases ""Zvezda po imeni Solntse""","The band Kino released the album ""Zvezda po imeni Solntse"" in 1989. This gave Soviet and Russian listeners a fresh emotional model, and its sound spread through broadcasts, imports, and home copying."
1989,Moscow Music Peace Festival,"The Moscow Music Peace Festival was held. This amplified shared cultural energy and rewarded brighter, bigger, and more communal musical moods."
1989,Nirvana releases Bleach,"Nirvana released Bleach. This gave Soviet and Russian listeners a fresh emotional model, and its sound spread through broadcasts, imports, and home copying."
1989,Peak popularity of Laskovyi May,"By 1989, Laskovyi May had become one of the most commercially visible Soviet pop acts. This reshaped commercial incentives and nudged artists toward sounds that matched newly visible audiences and emotions."
1989,Soviet withdrawal from Afghanistan,"The Soviet withdrawal from Afghanistan in 1989 closed a costly war that had haunted the late Soviet mood. This pushed music toward darker, more anxious, and more fatalistic moods while making patriotic and protest impulses more intense."
1989,Fall of the Berlin Wall changes Eastern Europe,"The fall of the Berlin Wall transformed Eastern Europe. The event made liberation, uncertainty, and historical acceleration central emotional themes in music reception."
1989,Congress of People's Deputies debates grip television audiences,Televised Congress of People's Deputies debates gripped Soviet audiences. The rawness of public conflict made direct and confrontational expression feel newly normal.
1989,First relatively competitive Soviet elections are held,The first relatively competitive Soviet elections were held. The sense that history was moving quickly encouraged more open and emotionally charged cultural expression.
1989,Tiananmen crackdown shocks communist societies,The Tiananmen crackdown shocked communist societies around the world. Its violence intensified fear about how reform movements could end.
1989,Scorpions and other foreign acts become more imaginable live,Foreign rock acts became more imaginable as live presences for Soviet audiences. That nearness of world music increased excitement and outward-looking emotional energy.
1990,Deepening crisis in the USSR,"The political and economic crisis in the USSR deepened. This deepened social stress and economic insecurity, often favoring bleak, ironic, and survival-oriented moods in music."
1990,Depeche Mode releases Violator,"Depeche Mode released Violator. This gave Soviet and Russian listeners a fresh emotional model, and its sound spread through broadcasts, imports, and home copying."
1990,Rise of Madchester and rave culture,Madchester and rave culture rose to prominence. This reshaped commercial incentives and nudged artists toward sounds that matched newly visible audiences and emotions.
1990,Viktor Tsoi Dies,"Viktor Tsoi died. This triggered public mourning and strengthened the pull of elegiac, intimate, and memory-driven music."
1990,Declaration of State Sovereignty of the RSFSR,"The Russian republic declared its sovereignty in 1990, accelerating the fragmentation of Soviet political authority. This sharpened questions of identity and belonging, making music more sensitive to symbolic loyalty and cultural division."
1990,Law on the press weakens censorship,The Soviet law on the press weakened censorship. It made sharper lyrics and more candid emotional language feel possible in mass culture.
1990,McDonald's opens in Moscow,McDonald's opened in Moscow as a symbol of consumer change. The new commercial optimism helped brighter and more playful pop aesthetics feel timely.
1990,Black January in Baku shocks the USSR,Violence in Baku during Black January shocked the USSR. The bloodshed intensified the feeling that collapse and grief were entering everyday life.
1990,Germany is reunified,"Germany was reunified. The remaking of Europe made historical change feel real and accelerated, which fed anticipation and disorientation alike."
1990,The Gulf crisis begins,"The Gulf crisis began and filled television with military tension. The atmosphere strengthened the emotional pull of dread, spectacle, and anxious anticipation."
1991,August Coup Attempt,"An attempted coup took place in the USSR in August 1991. This sharpened questions of identity and belonging, making music more sensitive to symbolic loyalty and cultural division."
1991,"Kino releases the ""Black Album""","The album known as the ""Black Album"" by Kino was released in 1991 after Viktor Tsoi’s death. This gave Soviet and Russian listeners a fresh emotional model, and its sound spread through broadcasts, imports, and home copying."
1991,Soviet Union is dissolved,"The Soviet Union was dissolved. This sharpened questions of identity and belonging, making music more sensitive to symbolic loyalty and cultural division."
1991,Violence in Vilnius and Riga,"Violent January confrontations in Vilnius and Riga showed that the Soviet breakup could turn deadly. This intensified anxious, tense, and vulnerable moods around cultural life and listening."
1991,Boris Yeltsin is elected president of the RSFSR,"Boris Yeltsin's election as president of the RSFSR gave Russia a rival center of democratic legitimacy inside the USSR. This strengthened forward-looking, searching, and transitional moods in the music field."
1991,Monsters of Rock in Moscow draws a massive crowd,The Monsters of Rock festival in Moscow drew a massive crowd. It symbolized the sudden scale of musical freedom and gave rock a euphoric public emotional force.
1991,Freddie Mercury dies,Freddie Mercury died. His death brought a global wave of mourning that also touched post-Soviet listeners entering a new era.
1991,Gulf War dominates television at the start of the year,The Gulf War dominated television at the start of 1991. Its imagery fused spectacle with fear and made conflict feel central to modern media emotion.
1991,Saint Petersburg name is restored,Leningrad voted to restore the name Saint Petersburg. The symbolic break with the Soviet past encouraged more reflective and identity-driven cultural moods.
1991,Empty shelves and panic buying define late-Soviet daily life,"Empty shelves and panic buying defined late-Soviet daily life. That exhaustion and insecurity made raw, bitter, and survival-oriented songs feel especially true."
1992,Collapse of the Soviet music distribution system,"State music-distribution systems collapsed and were rapidly replaced by a fragmented post-Soviet market. This deepened social stress and economic insecurity, often favoring bleak, ironic, and survival-oriented moods in music."
1992,Rapid expansion of private cassette and CD trade in Russia,Private cassette and CD trade expanded quickly in Russia during the early post-Soviet years. This reshaped commercial incentives and nudged artists toward sounds that matched newly visible audiences and emotions.
1992,Russia starts shock therapy reforms,"Russia began shock therapy economic reforms. This deepened social stress and economic insecurity, often favoring bleak, ironic, and survival-oriented moods in music."
1992,Price liberalization shocks everyday life,"Price liberalization at the start of 1992 produced an immediate shock in everyday Russian life. This deepened social stress and economic insecurity, often favoring bleak, ironic, and survival-oriented moods in music."
1992,Voucher privatization begins,"Voucher privatization began in 1992 and symbolized the abrupt remaking of the post-Soviet economy. This intensified cynicism and moral revulsion, making harsher and more sarcastic moods feel more natural."
1992,Russia adopts the tricolor as the main state symbol,"Russia consolidated the white-blue-red tricolor as the main state symbol. The symbolic break with the Soviet past pushed music toward searching, unsettled identity themes."
1992,War in Transnistria breaks out,"War in Transnistria broke out in the post-Soviet space. The violence signaled that the Soviet collapse would carry real bloodshed, darkening public mood."
1992,Freddie Mercury Tribute Concert becomes a global TV event,The Freddie Mercury Tribute Concert became a global television event. It linked rock spectacle with mourning and reinforced the prestige of emotionally open memorial music.
1992,Dr. Dre releases The Chronic,"Dr. Dre released The Chronic. Its laid-back but hard-edged sound influenced how Russian youth later heard swagger, groove, and urban cool."
1992,Barcelona Olympics become the Unified Team's last shared afterglow,The Barcelona Olympics gave the former Soviet republics a final shared moment as the Unified Team. That brief unity fed nostalgia at a time of rapid cultural fragmentation.
1993,Expansion of commercial music television in Russia,Commercial music television expanded in Russia. This reshaped commercial incentives and nudged artists toward sounds that matched newly visible audiences and emotions.
1993,Expansion of pirate cassette and CD markets in Russia,Pirate cassette and CD markets expanded in Russia. This reshaped commercial incentives and nudged artists toward sounds that matched newly visible audiences and emotions.
1993,MP3 standard is finalized,"The MP3 standard was finalized. This changed how songs were discovered and shared, helping new moods and styles spread faster than before."
1993,Russian constitutional crisis and shelling of the White House,"The 1993 constitutional crisis culminated in armed confrontation and the shelling of the Russian White House in Moscow. This intensified anxious, tense, and vulnerable moods around cultural life and listening."
1993,New Russian Constitution is adopted,"Russia adopted a new Constitution in December 1993 and consolidated a powerful presidency. This sharpened questions of identity and belonging, making music more sensitive to symbolic loyalty and cultural division."
1993,Russia withdraws old Soviet banknotes,"Russia withdrew old Soviet banknotes during a chaotic currency reform. The jolt deepened insecurity and made bitter, improvised, and streetwise music feel closer to reality."
1993,Russia holds its first post-Soviet parliamentary election,Russia held its first post-Soviet parliamentary election. The unstable pluralism of the moment pushed public culture toward confrontation rather than consensus.
1993,Nirvana releases In Utero,Nirvana released In Utero. Its abrasive vulnerability matched the rawness of the early Russian transition and resonated strongly with listeners.
1993,Snoop Doggy Dogg releases Doggystyle,Snoop Doggy Dogg released Doggystyle. Its relaxed confidence helped define a new global hip-hop cool that later fed Russian urban styles.
