year,event_name,description
1971,Carole King releases Music and Tapestry-era songs remain influential,"Carole King remained globally influential through Music and the continuing impact of Tapestry. Her intimate songwriting strengthened the prestige of honest, conversational emotion in popular music."
1971,Marvin Gaye releases What's Going On,"Marvin Gaye released What's Going On. This gave Soviet and Russian listeners a fresh emotional model, and its sound spread through broadcasts, imports, and home copying."
1971,Pesnya Goda launches on Soviet television,"The annual television music festival Pesnya Goda was launched in 1971. This changed how songs were discovered and shared, helping new moods and styles spread faster than before."
1971,24th Congress of the CPSU,"The 24th Congress of the CPSU reaffirmed the language of stability and centralized cultural management in the USSR. This narrowed the range of acceptable themes and pushed musical expression toward coded bitterness, tension, or self-censorship."
1971,Death of Nikita Khrushchev,"Former Soviet leader Nikita Khrushchev died in 1971, closing a symbolic chapter associated with the Thaw. This triggered public mourning and strengthened the pull of elegiac, intimate, and memory-driven music."
1971,Louis Armstrong dies,Louis Armstrong died. His death brought renewed attention to jazz's emotional warmth and historic depth among Soviet listeners.
1971,Led Zeppelin releases Led Zeppelin IV,Led Zeppelin released Led Zeppelin IV. Its scale and mystique broadened the emotional ambition of rock that Soviet listeners sought out on tapes and imported records.
1971,John Lennon releases Imagine,John Lennon released Imagine. Its plainspoken idealism reinforced the appeal of reflective and hopeful songwriting among Soviet urban listeners.
1971,Concert for Bangladesh is staged,"George Harrison and Ravi Shankar staged the Concert for Bangladesh. The event tied popular music to compassion and global conscience, encouraging a more humane emotional frame around songs."
1971,Igor Stravinsky dies,Composer Igor Stravinsky died in New York. The loss reminded Soviet musicians and listeners of a major Russian modernist legacy that official culture had long treated ambivalently.
1972,Aquarium is founded in Leningrad,"The band Aquarium was founded in Leningrad in 1972. This gave musicians more room to experiment and strengthened hopeful, searching, and forward-looking moods."
1972,Growth of author-song circulation on home tapes,Author songs and concert recordings continued to circulate through home tapes and informal exchange. This reshaped commercial incentives and nudged artists toward sounds that matched newly visible audiences and emotions.
1972,50th anniversary of the USSR,"The Soviet Union marked its 50th anniversary with large official celebrations and reaffirmations of state identity. This fed triumphant and celebratory moods and favored songs built around confidence, spectacle, and collective feeling."
1972,Summit Series between the USSR and Canada,"The 1972 hockey Summit Series between the USSR and Canada became an emotional Cold War spectacle for Soviet audiences. This fed triumphant and celebratory moods and favored songs built around confidence, spectacle, and collective feeling."
1972,SALT I is signed,The USSR and the United States signed SALT I. The easing of superpower tension made foreign cultural exchange feel slightly more imaginable and future-oriented.
1972,David Bowie releases Ziggy Stardust,David Bowie released The Rise and Fall of Ziggy Stardust and the Spiders from Mars. Its theatrical self-invention expanded the emotional and stylistic horizons of rock heard through Soviet informal channels.
1972,Deep Purple releases Machine Head,"Deep Purple released Machine Head. Its hard-driving sound strengthened the appeal of muscular, high-intensity rock for Soviet guitar enthusiasts."
1972,Munich Olympic massacre shocks the world,The Munich Olympic massacre turned a sports festival into a global trauma. The shock darkened the wider emotional climate and made fear more central in media and popular conversation.
1972,Watergate begins in the United States,"The Watergate scandal began with the break-in at Democratic headquarters. Its global publicity fed cynicism about power, which resonated with darker and more skeptical moods in music reception."
1973,Oil Crisis 1973,"The 1973 oil crisis began. This deepened social stress and economic insecurity, often favoring bleak, ironic, and survival-oriented moods in music."
1973,David Bowie releases Aladdin Sane,David Bowie released Aladdin Sane. Its theatrical instability added glamour and nervous tension to the emotional possibilities of art rock reaching Soviet listeners.
1973,Premiere of the soundtrack to Seventeen Moments of Spring,"Music by Mikael Tariverdiev for the television series ""Seventeen Moments of Spring"" was first heard in 1973. This gave Soviet and Russian listeners a fresh emotional model, and its sound spread through broadcasts, imports, and home copying."
1973,Premiere of Ivan Vasilievich Changes Profession,"Leonid Gaidai's film Ivan Vasilievich Changes Profession premiered in 1973 and quickly became a mass-cultural hit. This amplified shared cultural energy and rewarded brighter, bigger, and more communal musical moods."
1973,Détente-era cultural exchange reaches a high point,"Détente-era exchanges made selected foreign cultural products feel unusually visible and discussable in the USSR in 1973. This gave musicians more room to experiment and strengthened hopeful, searching, and forward-looking moods."
1973,Pink Floyd releases The Dark Side of the Moon,"Pink Floyd released The Dark Side of the Moon. Its themes of pressure, time, and mental strain gave Soviet listeners a powerful new template for introspective melancholy."
1973,Yom Kippur War and oil shock unsettle the world,The Yom Kippur War and the oil shock unsettled international politics and everyday expectations. The tense atmosphere made anxious and apocalyptic moods feel more believable in popular music.
1973,Military coup in Chile overthrows Allende,"A military coup in Chile overthrew Salvador Allende's government. For many Soviet listeners, the event sharpened the emotional charge of protest, solidarity, and political songs."
1973,USSR support for Arab allies dominates news,Soviet involvement around the Middle East crisis became a major news theme. Constant geopolitical tension pushed public feeling toward seriousness and away from carefree cultural moods.
1973,Jesus Christ Superstar spreads through unofficial circulation,The rock opera Jesus Christ Superstar spread in the USSR through unofficial circulation. Its dramatic blend of spirituality and rock widened the emotional palette available to underground listeners.
1974,Alla Pugacheva's all-Union rise begins,"Alla Pugacheva’s national breakthrough accelerated in the mid-1970s through television, festivals and recordings. This reshaped commercial incentives and nudged artists toward sounds that matched newly visible audiences and emotions."
1974,Expansion of VIA repertory on Soviet television,Vocal-instrumental ensembles continued to expand their presence on Soviet television and state concert stages. This reshaped commercial incentives and nudged artists toward sounds that matched newly visible audiences and emotions.
1974,Growth of apartment concerts in major Soviet cities,Apartment concerts became a more visible format of informal musical performance in major Soviet cities. This reshaped commercial incentives and nudged artists toward sounds that matched newly visible audiences and emotions.
1974,Solzhenitsyn is expelled from the USSR,"Aleksandr Solzhenitsyn was expelled from the USSR. This narrowed the range of acceptable themes and pushed musical expression toward coded bitterness, tension, or self-censorship."
1974,Baikal-Amur Mainline construction is relaunched,"The Soviet leadership relaunched the Baikal-Amur Mainline project as a huge prestige campaign for youth labor and socialist optimism. This fed triumphant and celebratory moods and favored songs built around confidence, spectacle, and collective feeling."
1974,David Bowie releases Diamond Dogs,David Bowie released Diamond Dogs. Its dystopian theatricality fed the appeal of stylized tension and futuristic unease in art rock heard unofficially in the USSR.
1974,ABBA wins Eurovision with Waterloo,"ABBA won the Eurovision Song Contest with Waterloo. Their bright, polished pop became a model of melodic optimism that many Soviet listeners later pursued through imports and broadcasts."
1974,Mikhail Baryshnikov defects,Mikhail Baryshnikov defected during a tour in Canada. The defection dramatized the pull of artistic freedom and made official culture feel more emotionally constrained by comparison.
1974,Richard Nixon resigns over Watergate,"Richard Nixon resigned over Watergate. The scandal's resolution deepened global mistrust of authority and reinforced a harsher, more disillusioned emotional climate."
1974,Jackson-Vanik amendment links trade and emigration,The Jackson-Vanik amendment linked trade with the USSR to emigration policy. It kept questions of openness and restriction in the background of Soviet cultural life and sharpened sensitivity to blocked horizons.
1975,"Alla Pugacheva wins Golden Orpheus with ""Arlekino""","Alla Pugacheva won the Golden Orpheus festival in Bulgaria in 1975 with the song ""Arlekino"". This amplified shared cultural energy and rewarded brighter, bigger, and more communal musical moods."
1975,Expansion of Soviet pop television formats,Central Soviet television increased the visibility of variety concerts and song festivals in the mid-1970s. This reshaped commercial incentives and nudged artists toward sounds that matched newly visible audiences and emotions.
1975,Queen releases Bohemian Rhapsody,"The single and video became major global hits. This gave Soviet and Russian listeners a fresh emotional model, and its sound spread through broadcasts, imports, and home copying."
1975,Helsinki Final Act is signed,"The Helsinki Final Act was signed in 1975 and became an important symbol of East-West dialogue and human-rights language. This gave musicians more room to experiment and strengthened hopeful, searching, and forward-looking moods."
1975,Apollo-Soyuz mission becomes a détente spectacle,"The Apollo-Soyuz mission turned Soviet-American cooperation into a widely watched spectacle in 1975. This strengthened forward-looking, searching, and transitional moods in the music field."
1975,Andrei Sakharov receives the Nobel Peace Prize,Andrei Sakharov received the Nobel Peace Prize. His recognition strengthened the moral prestige of dissent and gave reflective songwriting a more ethical emotional frame.
1975,Pink Floyd releases Wish You Were Here,Pink Floyd released Wish You Were Here. Its themes of absence and alienation deepened the attraction of melancholy and distance in late-Soviet listening.
1975,Led Zeppelin releases Physical Graffiti,"Led Zeppelin released Physical Graffiti. Its scale and swagger reinforced the appeal of expansive, high-energy rock in Soviet tape culture."
1975,Fall of Saigon ends the Vietnam War,"The fall of Saigon ended the Vietnam War. The images of closure, defeat, and exhaustion made global music culture more receptive to weary and reflective moods."
1975,Bruce Springsteen releases Born to Run,Bruce Springsteen released Born to Run. Its restless desire for escape resonated strongly with listeners living inside a more closed and regulated world.
1976,Consolidation of the Leningrad underground rock scene,The Leningrad underground rock scene became more organized. This reshaped commercial incentives and nudged artists toward sounds that matched newly visible audiences and emotions.
1976,"Premiere of the film ""Irony of Fate""","The television film ""Irony of Fate, or Enjoy Your Bath!"" premiered in 1976 with music by Mikael Tariverdiev. This gave Soviet and Russian listeners a fresh emotional model, and its sound spread through broadcasts, imports, and home copying."
1976,Soviet Dissident Crackdowns,"Soviet authorities intensified pressure on dissidents. This narrowed the range of acceptable themes and pushed musical expression toward coded bitterness, tension, or self-censorship."
1976,25th Congress of the CPSU,"The 25th Congress of the CPSU again projected official stability and ideological continuity at the center of Soviet life. This narrowed the range of acceptable themes and pushed musical expression toward coded bitterness, tension, or self-censorship."
1976,Disco boom reaches Soviet dance floors,"By 1976 the global disco boom was increasingly audible in Soviet dance culture, even through filtered and unofficial channels. This gave Soviet and Russian listeners a fresh emotional model, and its sound spread through broadcasts, imports, and home copying."
1976,ABBA releases Dancing Queen,ABBA released Dancing Queen. Its gleaming joy became a durable model of escapist happiness for Soviet listeners encountering disco through unofficial channels.
1976,Eagles release Hotel California,Eagles released Hotel California. Its mix of glamour and emptiness helped make ironic and bittersweet moods more attractive to Soviet listeners.
1976,Punk breaks into scandal in Britain,"A confrontational British punk act turned punk into a public scandal in Britain. Through bootlegs and word of mouth, punk introduced a sharper language of anger and rupture to Soviet and Russian listeners."
1976,Moscow Helsinki Group is formed,The Moscow Helsinki Group was formed to monitor Soviet compliance with human-rights commitments. Its appearance signaled that moral and political tension would increasingly shape the emotional climate around art.
1976,Tangshan earthquake shocks socialist societies,The Tangshan earthquake killed hundreds of thousands in China. The scale of the disaster intensified a broader feeling of fragility that also shadowed popular culture.
1977,Expansion of unofficial rock audiences in major Soviet cities,"Unofficial audiences for rock music expanded in Moscow, Leningrad and other major Soviet cities. This reshaped commercial incentives and nudged artists toward sounds that matched newly visible audiences and emotions."
1977,Growth of apartment-concert circulation for bard and rock music,Apartment concerts and home-tape circulation became increasingly important channels for bard and rock music in the late 1970s. This reshaped commercial incentives and nudged artists toward sounds that matched newly visible audiences and emotions.
1977,Saturday Night Fever soundtrack is released,"The Saturday Night Fever soundtrack was released. This gave Soviet and Russian listeners a fresh emotional model, and its sound spread through broadcasts, imports, and home copying."
1977,Landmark British punk album ignites controversy,"A landmark British punk album ignited controversy in 1977 and helped define punk's public image. Through broadcasts, imports, and home copying, it gave Soviet and Russian listeners a stronger model of rebellious and confrontational feeling."
1977,New Soviet Constitution is adopted,"The 1977 Soviet Constitution formalized the late-Brezhnev political order and its rhetoric of developed socialism. This narrowed the range of acceptable themes and pushed musical expression toward coded bitterness, tension, or self-censorship."
1977,1977 Moscow bombings shake the Soviet capital,"Bombings in Moscow shook the Soviet capital in 1977. The attacks pushed urban feeling toward vigilance and fear, which made darker music feel more emotionally plausible."
1977,Elvis Presley dies,Elvis Presley died at the age of 42. His death closed a foundational chapter of rock and roll and brought a wave of nostalgia and loss to listeners.
1977,Saturday Night Fever turns disco into a mass mood,Saturday Night Fever turned disco into a global mass mood. Its dance-floor energy offered a bright emotional counterweight to the stiffness of late-Soviet everyday life.
1977,Voyager carries the Golden Record into space,Voyager carried a Golden Record of world music into space. The gesture gave music a futuristic and civilizational symbolism that strengthened feelings of wonder and anticipation.
1977,60th anniversary of the October Revolution becomes a giant spectacle,The USSR marked the 60th anniversary of the October Revolution with major official spectacle. Such ritual pageantry kept public music highly ceremonial and emotionally controlled in the mainstream.
1978,Boney M Performs in Moscow,"Boney M performed in Moscow. This amplified shared cultural energy and rewarded brighter, bigger, and more communal musical moods."
1978,"Premiere of the film ""The Woman Who Sings""","The film ""The Woman Who Sings"" starring Alla Pugacheva was released in 1978. This gave Soviet and Russian listeners a fresh emotional model, and its sound spread through broadcasts, imports, and home copying."
1978,Russian SFSR constitution is adopted,"The Russian SFSR adopted its own new constitution in 1978, echoing the broader late-Soviet legal framework. This narrowed the range of acceptable themes and pushed musical expression toward coded bitterness, tension, or self-censorship."
1978,Disco culture spreads through youth clubs,"Disco culture spread more visibly through Soviet youth clubs and dance events in 1978. This amplified shared cultural energy and rewarded brighter, bigger, and more communal musical moods."
1978,Aquarium's underground fame widens,"Aquarium's reputation widened in the Soviet underground as Leningrad listeners traded tapes and stories about new rock writing. This gave musicians more room to experiment and strengthened hopeful, searching, and forward-looking moods."
1978,Boney M becomes a black-market sensation in the USSR,Boney M became a black-market sensation across the USSR. Their catchy disco brightness gave unofficial listening a more festive and escapist emotional charge.
1978,Grease becomes a global youth phenomenon,The film Grease became a global youth phenomenon. Its nostalgic musical exuberance widened the appeal of playful retro moods in popular music.
1978,Camp David Accords ease superpower tension,The Camp David Accords briefly eased tension in the Middle East and beyond. Moments of diplomatic relief made optimistic and open emotional tones feel more credible.
1978,Jonestown shocks the world,The Jonestown mass death shocked the world. Its horror darkened media culture and reinforced the emotional pull of fear and distrust.
1978,John Paul II is elected pope,"The election of John Paul II transformed the emotional atmosphere of Eastern Europe. For Soviet audiences, it hinted that moral energy and public feeling could move history again."
1979,Growth of hard-edged underground rock in late Soviet cities,"By the end of the 1970s, underground rock scenes in major Soviet cities had become more visible and structured. This reshaped commercial incentives and nudged artists toward sounds that matched newly visible audiences and emotions."
1979,Soviet Invasion of Afghanistan,"Soviet troops entered Afghanistan. This pushed music toward darker, more anxious, and more fatalistic moods while making patriotic and protest impulses more intense."
1979,Spread of cassette listening and home duplication in the USSR,"Cassette listening and home duplication became increasingly common in Soviet urban music exchange by the end of the 1970s. This changed how songs were discovered and shared, helping new moods and styles spread faster than before."
1979,Iranian Revolution heightens global instability,"The Iranian Revolution added to a wider sense of global instability at the end of the 1970s. This pushed music toward darker, more anxious, and more fatalistic moods while making patriotic and protest impulses more intense."
1979,Post-punk and new wave reach Soviet tape traders,"Post-punk and new wave increasingly reached Soviet tape traders and technically curious listeners in 1979. This gave Soviet and Russian listeners a fresh emotional model, and its sound spread through broadcasts, imports, and home copying."
1979,The Clash releases London Calling,"The Clash released London Calling. Its mix of urgency, anxiety, and breadth gave politically alert rock a stronger emotional pull for underground listeners."
1979,Sony releases the Walkman,"Sony released the Walkman. Portable private listening changed how young people related to songs and intensified inward, individualized musical emotion."
1979,Pink Floyd releases The Wall,Pink Floyd released The Wall. Its narrative of alienation and pressure resonated deeply with listeners who felt trapped by institutions and routine.
1979,The Buggles release Video Killed the Radio Star,"The Buggles released Video Killed the Radio Star. The song captured a coming media shift and sharpened awareness that sound, image, and technology were merging."
1979,Disco Demolition Night signals a backlash against disco,Disco Demolition Night signaled a backlash against disco culture in the United States. The event made musical taste feel more combative and culturally polarized even far beyond the US.
1980,Cultural program of the 1980 Moscow Olympics,"The cultural program of the 1980 Moscow Olympics took place. This amplified shared cultural energy and rewarded brighter, bigger, and more communal musical moods."
1980,Tbilisi-80 rock festival,"The Tbilisi-80 spring rhythms festival was held in 1980 and became the first major official Soviet rock festival. This amplified shared cultural energy and rewarded brighter, bigger, and more communal musical moods."
1980,Vladimir Vysotsky Dies,"Vladimir Vysotsky died. This triggered public mourning and strengthened the pull of elegiac, intimate, and memory-driven music."
1980,Moscow Olympics are hit by a boycott,"The Moscow Olympics were overshadowed by a US-led boycott after the Soviet invasion of Afghanistan. This sharpened questions of identity and belonging, making music more sensitive to symbolic loyalty and cultural division."
1980,Death of John Lennon shocks Soviet listeners,"John Lennon was murdered in December 1980, and the news resonated powerfully with Soviet Beatles fans. This triggered public mourning and strengthened the pull of elegiac, intimate, and memory-driven music."
1980,Solidarity rises in Poland,The Solidarity movement rose in Poland and unsettled the socialist bloc. Its challenge to one-party certainty made political songs and anxious listening feel more relevant across the region.
1980,Ian Curtis dies,"Joy Division singer Ian Curtis died. His death intensified the bond between post-punk and despair, which echoed in underground Soviet listening."
1980,AC/DC releases Back in Black,"AC/DC released Back in Black. Its hard, resilient energy gave guitar rock a more defiant emotional model during a grim year."
1980,John Bonham dies and Led Zeppelin ends,"John Bonham died and Led Zeppelin soon ended. For Soviet rock fans, the breakup of another giant band added to the era's feeling of endings and loss."
1980,Teheran 43 becomes a Soviet box-office hit,"The Soviet film Teheran 43 became a major box-office hit. Its sweeping soundtrack and atmosphere fed public appetite for dramatic, emotionally charged popular music."
1981,Leningrad Rock Club Opens,"The Leningrad Rock Club opened. This changed how songs were discovered and shared, helping new moods and styles spread faster than before."
1981,"Premiere of the rock opera ""Juno and Avos""","The rock opera ""Juno and Avos"" premiered at the Lenkom Theatre in 1981. This gave Soviet and Russian listeners a fresh emotional model, and its sound spread through broadcasts, imports, and home copying."
1981,Soft Cell releases Tainted Love,"Soft Cell released 'Tainted Love'. This gave Soviet and Russian listeners a fresh emotional model, and its sound spread through broadcasts, imports, and home copying."
1981,26th Congress of the CPSU,"The 26th Congress of the CPSU extended the vocabulary of official stability while everyday stagnation deepened. This narrowed the range of acceptable themes and pushed musical expression toward coded bitterness, tension, or self-censorship."
1981,Poland enters martial law,"The declaration of martial law in Poland in late 1981 darkened the atmosphere across the Soviet bloc. This intensified anxious, tense, and vulnerable moods around cultural life and listening."
1981,MTV launches,"MTV launched in the United States. Even where it was watched only indirectly, the rise of video-centered pop changed how Soviet youth imagined musical style and emotion."
1981,Prince releases Controversy,"Prince released Controversy. Its mix of funk, provocation, and style widened the emotional boldness later sought by Soviet listeners through tapes."
1981,Royal wedding becomes a global television spectacle,The wedding of Charles and Diana became a global television spectacle. Its polished pageantry reinforced the emotional power of televised glamour at a time when TV pop was becoming more visual.
1981,Moscow Does Not Believe in Tears wins the Oscar,"Moscow Does Not Believe in Tears won the Academy Award for best foreign-language film. Its emotional realism strengthened the prestige of intimate, everyday feeling in Soviet mass culture."
1981,The Human League release Dare,"The Human League released Dare. Its synth-pop polish helped make electronic textures feel modern, bright, and emotionally efficient to Soviet listeners."
1982,Brezhnev Dies,"Leonid Brezhnev died. This triggered public mourning and strengthened the pull of elegiac, intimate, and memory-driven music."
1982,Kino takes shape in Leningrad,"The band Kino took shape in Leningrad in the early 1980s around Viktor Tsoi and his collaborators. This gave musicians more room to experiment and strengthened hopeful, searching, and forward-looking moods."
