year,event_name,description
1993,Oslo peace process briefly lifts global optimism,The Oslo peace process briefly lifted global optimism. Moments like that made gentler and more hopeful emotional tones feel believable amid turmoil.
1994,First Chechen War Begins,"The First Chechen War began. This pushed music toward darker, more anxious, and more fatalistic moods while making patriotic and protest impulses more intense."
1994,"Nautilus Pompilius releases ""Titanik""","Nautilus Pompilius released the album ""Titanik"" in 1994. This gave Soviet and Russian listeners a fresh emotional model, and its sound spread through broadcasts, imports, and home copying."
1994,Split of the Russian mass market between eurodance and chanson,The Russian mass music market split between eurodance and chanson. This reshaped commercial incentives and nudged artists toward sounds that matched newly visible audiences and emotions.
1994,MMM pyramid scheme collapses,"The collapse of the MMM financial pyramid damaged public trust and became a landmark of 1990s social cynicism. This intensified cynicism and moral revulsion, making harsher and more sarcastic moods feel more natural."
1994,Death of Kurt Cobain,"Kurt Cobain died in 1994, and the shock strongly influenced alternative-rock listeners in Russia as well as globally. This triggered public mourning and strengthened the pull of elegiac, intimate, and memory-driven music."
1994,Budapest Memorandum redraws post-Soviet security expectations,"The Budapest Memorandum redrew security expectations in the post-Soviet region. It fed uncertainty about borders and futures, which pushed music reception toward unease."
1994,Woodstock '94 revives festival nostalgia,"Woodstock '94 revived festival nostalgia on a global scale. The event renewed interest in communal, cathartic rock feeling among Russian listeners too."
1994,Ace of Base and eurodance dominate Russian discos,Ace of Base and eurodance dominated Russian discos and radio. Their bright dance energy offered escapist happiness against a violent and unstable backdrop.
1994,Pulp Fiction resets soundtrack culture,Pulp Fiction reset soundtrack culture worldwide. Its stylized use of old songs made irony and collage more attractive in youth taste.
1994,Russian troops storm Grozny,Russian troops stormed Grozny during the first Chechen war. The televised urban destruction deepened dread and grief in Russian public feeling.
1995,Commercial consolidation of Russian chanson,Russian chanson consolidated as a mass commercial genre. This reshaped commercial incentives and nudged artists toward sounds that matched newly visible audiences and emotions.
1995,Spread of eurodance aesthetics in Russian pop,"Dance-pop and eurodance aesthetics remained highly visible in Russian radio, television and nightlife in 1995. This reshaped commercial incentives and nudged artists toward sounds that matched newly visible audiences and emotions."
1995,Murder of Vladislav Listyev,"Television star Vladislav Listyev was murdered in 1995, shocking the country and symbolizing the lawlessness of the era. This intensified cynicism and moral revulsion, making harsher and more sarcastic moods feel more natural."
1995,Budyonnovsk hospital hostage crisis,"The Budyonnovsk hospital hostage crisis brought the Chechen war's terror directly into Russian public consciousness. This created a climate of shock and vulnerability, making somber, tense, and security-focused moods more prominent."
1995,ORT becomes the main federal channel,The launch of ORT strengthened the central role of commercial federal television in shaping Russian mass taste. This reshaped commercial incentives and nudged artists toward sounds that matched newly visible audiences and emotions.
1995,50th anniversary of Victory Day centers war memory,"The 50th anniversary of Victory Day brought war memory back to the center of public culture. That monumental remembrance strengthened solemn, patriotic, and mournful tones in music."
1995,Srebrenica massacre darkens European mood,"The Srebrenica massacre darkened European mood. The atrocity reinforced the feeling that the decade's violence was not ending, which favored darker listening."
1995,Oklahoma City bombing heightens terror anxiety,The Oklahoma City bombing heightened terror anxiety. The attack strengthened a wider media climate of suspicion and fear that also colored music reception.
1995,Russian Radio and hit-format broadcasting consolidate,Hit-format radio consolidated around stations like Russian Radio. That created a more repetitive and commercially streamlined emotional center in mainstream pop.
1995,Eurovision 1995 renews interest in polished ballad pop,Eurovision 1995 renewed interest in polished ballad pop. Such continental song formats reinforced melodrama and sentimental accessibility in post-Soviet listening.
1996,Muz TV starts broadcasting in Russia,"Muz-TV began broadcasting in Russia. This changed how songs were discovered and shared, helping new moods and styles spread faster than before."
1996,The Prodigy releases Firestarter,"The Prodigy released 'Firestarter'. This gave Soviet and Russian listeners a fresh emotional model, and its sound spread through broadcasts, imports, and home copying."
1996,Use of pop concerts in the 1996 Russian presidential campaign,"Pop concerts were used as part of public campaigning during the 1996 Russian presidential election. This sharpened questions of identity and belonging, making music more sensitive to symbolic loyalty and cultural division."
1996,Khasavyurt Accord ends the first Chechen war,"The Khasavyurt Accord in 1996 ended large-scale fighting in the first Chechen war without resolving the deeper conflict. This pushed music toward darker, more anxious, and more fatalistic moods while making patriotic and protest impulses more intense."
1996,Murder of Tupac Shakur reverberates globally,"Tupac Shakur was murdered in 1996, and the event mattered for Russian listeners following the global rise of rap. This triggered public mourning and strengthened the pull of elegiac, intimate, and memory-driven music."
1996,Boris Yeltsin wins reelection after a media-driven campaign,"Boris Yeltsin won reelection after a media-driven campaign. The campaign fused politics and entertainment, encouraging pop music to sound more promotional and triumphant."
1996,Kizlyar-Pervomaysk hostage crisis shocks Russia,The Kizlyar-Pervomaysk hostage crisis shocked Russia. The spillover of wartime violence deepened fear and exhaustion in everyday emotional life.
1996,Spice Girls launch with Wannabe,"The Spice Girls launched globally with Wannabe. Their bright group identity helped restore playful confidence to mass pop, including in Russia."
1996,Euro 96 turns football chants into a common mass soundtrack,Euro 96 turned football chants into a common mass soundtrack. That reinforced a louder and more collective style of public musical emotion.
1996,A more expensive Russian music-video aesthetic takes hold,A more expensive music-video aesthetic began taking hold on Russian television. The shift pushed pop toward cleaner surfaces and more aspirational emotions.
1997,"Mumiy Troll releases ""Morskaya""","Mumiy Troll released the album ""Morskaya"" in 1997. This gave Soviet and Russian listeners a fresh emotional model, and its sound spread through broadcasts, imports, and home copying."
1997,Spread of MP3 distribution,"MP3 distribution spread rapidly. This changed how songs were discovered and shared, helping new moods and styles spread faster than before."
1997,The Prodigy release The Fat of the Land,"The Prodigy released The Fat of the Land. This gave Soviet and Russian listeners a fresh emotional model, and its sound spread through broadcasts, imports, and home copying."
1997,Moscow marks its 850th anniversary,"Moscow's 850th anniversary was celebrated with huge official festivities and a new urban spectacle politics. This amplified shared cultural energy and rewarded brighter, bigger, and more communal musical moods."
1997,FM-radio formatting boom in Russian cities,By 1997 tightly formatted FM radio had become a powerful engine of repetition and hit-making in Russian cities. This reshaped commercial incentives and nudged artists toward sounds that matched newly visible audiences and emotions.
1997,Princess Diana dies and triggers global mourning,Princess Diana died and triggered global mourning. The scale of public grief strengthened the emotional legitimacy of openly sentimental music.
1997,Titanic becomes a worldwide emotional phenomenon,"Titanic became a worldwide emotional phenomenon. Its soundtrack and melodrama made grand, tragic feeling newly fashionable in mass listening."
1997,Russia passes a restrictive law on religion,Russia passed a more restrictive law on religion and conscience. The harder cultural climate fed a sense that public life was tightening again.
1997,Russia and Belarus sign a union treaty,Russia and Belarus signed a union treaty. The move kept post-Soviet reintegration in the air and encouraged nostalgic political feeling.
1997,Asian financial crisis spreads late-decade instability,The Asian financial crisis spread late-decade instability. Its shock helped make insecurity and volatility feel like the global background of the era.
1998,First broad radio breakthrough of Zemfira,The first Zemfira songs reached a wide radio audience in 1998. This reshaped commercial incentives and nudged artists toward sounds that matched newly visible audiences and emotions.
1998,MTV Russia launches,"MTV Russia started broadcasting in 1998. This changed how songs were discovered and shared, helping new moods and styles spread faster than before."
1998,Russian Financial Default,"Russia defaulted on domestic debt and devalued the ruble. This deepened social stress and economic insecurity, often favoring bleak, ironic, and survival-oriented moods in music."
1998,Spread of Auto-Tune in Russian pop,"Auto-Tune spread in Russian pop after the success of 'Believe'. This changed how songs were discovered and shared, helping new moods and styles spread faster than before."
1998,Brother becomes a youth cult classic,"By 1998 the film Brother had become a youth cult classic whose soundtrack and attitude shaped late-1990s Russian taste. This gave Soviet and Russian listeners a fresh emotional model, and its sound spread through broadcasts, imports, and home copying."
1998,Cher releases Believe and mainstreams Auto-Tune,"Cher released Believe and mainstreamed Auto-Tune. The sound quickly changed what polished, future-facing pop emotion could feel like for Russian producers and listeners."
1998,Galina Starovoitova is murdered,Galina Starovoitova was murdered in Saint Petersburg. The killing deepened reform-era disillusionment and made public mood harsher and more distrustful.
1998,Kosovo crisis revives a European war scare,The Kosovo crisis revived a European war scare. The return of conflict language pushed emotional attention toward fear and instability.
1998,Google is founded and search culture begins,Google was founded and search culture began to change everyday information habits. That shift started moving music discovery toward faster and more self-directed exploration.
1998,1998 World Cup turns public space into a pop soundtrack zone,The 1998 FIFA World Cup turned public space into a pop soundtrack zone. Mass sports spectacle temporarily gave music a more communal and celebratory emotional function.
1999,Napster launches,"Napster launched. This changed how songs were discovered and shared, helping new moods and styles spread faster than before."
1999,Second Chechen War,"The Second Chechen War began. This pushed music toward darker, more anxious, and more fatalistic moods while making patriotic and protest impulses more intense."
1999,Zemfira releases her debut album,"Zemfira released her debut album in 1999. This gave Soviet and Russian listeners a fresh emotional model, and its sound spread through broadcasts, imports, and home copying."
1999,Russian apartment bombings,"A series of apartment bombings in Russian cities in 1999 created a nationwide atmosphere of fear and anger. This created a climate of shock and vulnerability, making somber, tense, and security-focused moods more prominent."
1999,Boris Yeltsin resigns on New Year's Eve,"Boris Yeltsin resigned on the last day of 1999 and handed power to Vladimir Putin. This strengthened forward-looking, searching, and transitional moods in the music field."
1999,NATO bombing of Yugoslavia splits Russian opinion,"NATO's bombing of Yugoslavia split Russian public opinion. The campaign intensified grievance, anti-Western feeling, and a taste for harsher patriotic tones."
1999,Britney Spears releases ...Baby One More Time,Britney Spears released ...Baby One More Time. Its teen-pop directness reset mainstream sweetness just as Russian media were becoming more youth-targeted.
1999,Columbine shocks global youth culture,The Columbine massacre shocked global youth culture. The tragedy darkened the emotional frame around adolescence and music subcultures.
1999,Winamp and MP3 sites spread among Russian students,"Winamp and early MP3 sites spread among Russian students. The shift made music collecting feel faster, more private, and less tied to official retail."
1999,The Matrix changes the look and mood of late-1990s pop,The Matrix changed the look and mood of late-1990s pop culture. Its cool alienation fed darker electronic and rap aesthetics entering Russian youth taste.
2000,"Release of the ""Brother 2"" soundtrack","The soundtrack to the film ""Brother 2"" was released in 2000. This gave Soviet and Russian listeners a fresh emotional model, and its sound spread through broadcasts, imports, and home copying."
2000,t.A.T.u. releases Ya Soshla S Uma,"The duo Tatu released 'Ya Soshla S Uma'. This gave Soviet and Russian listeners a fresh emotional model, and its sound spread through broadcasts, imports, and home copying."
2000,Kursk submarine disaster,"The sinking of the Kursk submarine in 2000 became a defining national trauma of the early Putin era. This encouraged more mournful and reflective tones and made fragile, grief-struck songs feel more immediate."
2000,Vladimir Putin is elected president,"Vladimir Putin won the 2000 presidential election and quickly imposed a new tone of centralization and order. This sharpened questions of identity and belonging, making music more sensitive to symbolic loyalty and cultural division."
2000,Ostankino television tower fire,"A major fire at Moscow's Ostankino television tower in 2000 disrupted broadcasting and revived anxiety around national media infrastructure. This encouraged more mournful and reflective tones and made fragile, grief-struck songs feel more immediate."
2000,Russia restores the Soviet melody for the national anthem,"Russia restored the Soviet melody for its national anthem with new lyrics soon after. The choice blended continuity and rupture, reinforcing a state-centered emotional tone in public music."
2000,Linkin Park releases Hybrid Theory,Linkin Park released Hybrid Theory. Its combination of angst and polish strongly influenced how Russian youth heard alienation and pressure.
2000,Gladiator becomes a soundtrack phenomenon,Gladiator became a global soundtrack phenomenon. Its heroic melancholy made epic and emotionally legible music feel newly fashionable.
2000,Second Chechen war remains a constant television backdrop,"The second Chechen war remained a constant television backdrop in Russia. That persistent violence darkened everyday feeling and strengthened the pull of grim, forceful songs."
2000,Pirated MP3 CDs become commonplace,Pirated MP3 CDs became commonplace in Russian cities. Cheap digital collections made listening more eclectic and less controlled by formal retail taste.
2001,Apple introduces the iPod,"Apple introduced the iPod. This changed how songs were discovered and shared, helping new moods and styles spread faster than before."
2001,Cultural response to the September 11 attacks,"The September 11 attacks shaped a broad cultural response. This created a climate of shock and vulnerability, making somber, tense, and security-focused moods more prominent."
2001,NTV takeover in Russia,"Control of the independent television channel NTV shifted after a corporate conflict in 2001. This narrowed the range of acceptable themes and pushed musical expression toward coded bitterness, tension, or self-censorship."
2001,Mumiy Troll represents Russia at Eurovision,"Mumiy Troll represented Russia at Eurovision in 2001, showing the continued symbolic importance of the contest. This amplified shared cultural energy and rewarded brighter, bigger, and more communal musical moods."
2001,Runet growth accelerates MP3 sharing,"Rapid growth of the Runet accelerated MP3 sharing and online fan communities in 2001. This changed how songs were discovered and shared, helping new moods and styles spread faster than before."
2001,Za steklom introduces reality-show culture to Russia,"Za steklom introduced reality-show culture to Russian television. The new voyeuristic format pushed pop culture toward immediacy, confession, and emotional display."
2001,New Russian anthem lyrics are adopted,New lyrics were adopted for Russia's restored national anthem. The change strengthened ceremonial and state-linked musical feeling in public life.
2001,Gorillaz release their debut album,Gorillaz released their debut album. The project's virtual identity widened the imaginative range of pop and made mediated emotion feel normal.
2001,War in Afghanistan begins,The war in Afghanistan began after the September 11 attacks. Its continuation prolonged a climate of fear that made darker and more guarded listening feel apt.
2001,Nord-Ost premieres as a new Moscow musical ambition,"The musical Nord-Ost premiered in Moscow as a symbol of Broadway-style ambition. It showed that Russian mass culture was trying to sound more polished, large-scale, and hopeful."
2002,Fabrika Zvezd launches in Russia,"The television talent project Fabrika Zvezd was launched in Russia in 2002. This changed how songs were discovered and shared, helping new moods and styles spread faster than before."
2002,Nord Ost theater hostage crisis in Moscow,"Armed militants seized the Nord-Ost theater in Moscow. This created a climate of shock and vulnerability, making somber, tense, and security-focused moods more prominent."
2002,t.A.T.u. releases 200 km/h in the Wrong Lane,"The duo Tatu released 200 km/h in the Wrong Lane. This gave Soviet and Russian listeners a fresh emotional model, and its sound spread through broadcasts, imports, and home copying."
2002,Pirate CD markets reach mass scale,By 2002 pirate CD markets had reached mass scale across Russian cities and towns. This reshaped commercial incentives and nudged artists toward sounds that matched newly visible audiences and emotions.
2002,SMS voting culture enters music television,"SMS voting culture started to transform music television and talent-show participation in Russia in 2002. This changed how songs were discovered and shared, helping new moods and styles spread faster than before."
2002,Kelly Clarkson wins the first American Idol,Kelly Clarkson won the first American Idol. The talent-show logic strengthened the dream of instant stardom that Russian television soon copied intensely.
2002,Eminem releases The Eminem Show,Eminem released The Eminem Show. Its mix of confession and provocation increased the prestige of emotionally raw mainstream rap.
2002,Avril Lavigne's breakout changes teen-pop styling,Avril Lavigne's breakout changed teen-pop styling worldwide. Her sound gave Russian youth a more sarcastic and restless emotional model than late-1990s sweetness.
2002,Euro cash launches in Europe,"Euro banknotes and coins entered circulation across much of Europe. The moment reinforced the feeling that everyday life was speeding into a new, integrated era."
2002,2002 World Cup turns anthem pop into mass background music,The 2002 FIFA World Cup turned anthem pop into mass background music. Big tournament songs pushed public listening toward collective excitement and uncomplicated uplift.
2003,Iraq War Begins,"The Iraq War began. This pushed music toward darker, more anxious, and more fatalistic moods while making patriotic and protest impulses more intense."
2003,Russia places third at Eurovision with t.A.T.u.,"The duo Tatu represented Russia at Eurovision 2003 in Riga and finished third. This amplified shared cultural energy and rewarded brighter, bigger, and more communal musical moods."
2003,iTunes Store launches,"The iTunes Store launched. This changed how songs were discovered and shared, helping new moods and styles spread faster than before."
2003,Arrest of Mikhail Khodorkovsky,"The arrest of Mikhail Khodorkovsky in 2003 marked a harder phase in the relationship between big business and the Kremlin. This sharpened questions of identity and belonging, making music more sensitive to symbolic loyalty and cultural division."
2003,Bombing at the Tushino rock festival,"A suicide bombing at the Tushino rock festival in Moscow in 2003 brought terror into a music-space itself. This created a climate of shock and vulnerability, making somber, tense, and security-focused moods more prominent."
2003,50 Cent releases Get Rich or Die Tryin',50 Cent released Get Rich or Die Tryin'. Its hardened confidence helped make rap bravado more commercially attractive to Russian youth culture.
2003,Rose Revolution erupts in Georgia,The Rose Revolution erupted in Georgia. The post-Soviet protest success revived the emotional language of political possibility across the region.
2003,SARS outbreak spreads global unease,The SARS outbreak spread global unease. The health scare fed a broader atmosphere of vulnerability and caution in everyday life.
2003,The White Stripes' Seven Nation Army becomes a global chant,The White Stripes' Seven Nation Army became a global chant. Its stadium afterlife showed how stripped-down hooks could carry mass collective emotion.
2003,Nashestvie returns after security fears,The Nashestvie rock festival returned after security fears and disruption. Its survival reinforced rock's role as a communal outlet for release and resilience in Russia.
2004,Beslan School Siege,"The Beslan school siege took place. This created a climate of shock and vulnerability, making somber, tense, and security-focused moods more prominent."
2004,Expansion of hip-hop on Russian music television,"By 2004, hip-hop artists and videos had become noticeably more visible on Russian music television and youth media. This reshaped commercial incentives and nudged artists toward sounds that matched newly visible audiences and emotions."
2004,Russian rap enters the mainstream,Hip-hop gained broader mass-media visibility in Russia during the mid-2000s. This reshaped commercial incentives and nudged artists toward sounds that matched newly visible audiences and emotions.
2004,Terror attacks hit Russian transport,"A string of terrorist attacks on planes and in the Moscow metro intensified the atmosphere of insecurity in 2004. This created a climate of shock and vulnerability, making somber, tense, and security-focused moods more prominent."
2004,Orange Revolution in Ukraine,"Ukraine's Orange Revolution became a major political reference point for Russian elites and audiences in 2004. This sharpened questions of identity and belonging, making music more sensitive to symbolic loyalty and cultural division."
2004,Moscow metro bombing shocks commuters,A bombing in the Moscow metro shocked commuters in early 2004. The attack intensified urban fear and made public mood sharper and more brittle.
2004,Ruslana wins Eurovision for Ukraine,Ruslana won Eurovision for Ukraine. Her high-energy folk-pop success made Slavic pop feel more exportable and physically intense.
2004,Facebook launches,Facebook launched. Social networking accelerated peer-to-peer taste formation and made musical mood more socially contagious.
2004,Green Day releases American Idiot,Green Day released American Idiot. Its political anger revived the appeal of protest-tinged rock during a tense year.
2004,Indian Ocean tsunami closes the year with global grief,The Indian Ocean tsunami closed the year with global grief. The scale of loss strengthened solemn and compassionate tones in public culture.
2005,Launch of YouTube,"YouTube launched. This changed how songs were discovered and shared, helping new moods and styles spread faster than before."
2005,Expansion of mobile music monetization,Paid ringtones and realtones became one of the main commercial music formats of the mid-2000s. This reshaped commercial incentives and nudged artists toward sounds that matched newly visible audiences and emotions.
2005,Peak of the mobile ringtone market in Russia,"The market for mobile ringtones and realtones reached a mass peak in Russia in the mid-2000s. This changed how songs were discovered and shared, helping new moods and styles spread faster than before."
2005,Post-Soviet protest wave,"A new wave of protests took place in several post-Soviet states. This made confrontational and socially charged tones feel more relevant in rock, rap, and singer-songwriter music."
2005,Live 8 revives stadium-scale activist pop,"Live 8 revived the model of stadium-scale activist pop in 2005 and was widely followed in global media. This amplified shared cultural energy and rewarded brighter, bigger, and more communal musical moods."
2005,Dima Bilan takes second place at Eurovision,Dima Bilan took second place at Eurovision. The result made glossy emotional ballad-pop feel newly competitive and prestigious in Russia.
2005,Monetization protests shake social optimism in Russia,Protests against social-benefit monetization shook optimism in Russia. The unrest made bitter and skeptical moods more audible beneath consumer-era pop shine.
