year,event_name,description
2005,MySpace becomes a key music-discovery network,MySpace became a key music-discovery network. It made scenes feel more self-organized and rewarded emotionally direct songs that circulated online.
2005,Hurricane Katrina reshapes benefit-concert culture,Hurricane Katrina reshaped benefit-concert culture. The disaster reminded pop audiences that music could still organize empathy at scale.
2005,Gorod 312 break through on Russian radio,"Gorod 312 broke through on Russian radio. Their melodic urban pop fit a mood that balanced sentiment, mobility, and everyday aspiration."
2006,"Maksim releases ""Trudnyy vozrast""","Singer Maksim released the album ""Trudnyy vozrast"" in 2006. This gave Soviet and Russian listeners a fresh emotional model, and its sound spread through broadcasts, imports, and home copying."
2006,Rise of Black Star as a commercial hip-hop label,Black Star emerged as a major commercial hip-hop label in Russia. This reshaped commercial incentives and nudged artists toward sounds that matched newly visible audiences and emotions.
2006,VKontakte launches in Russia,"The social network VKontakte was launched in Russia in 2006. This changed how songs were discovered and shared, helping new moods and styles spread faster than before."
2006,Murder of Anna Politkovskaya,"Journalist Anna Politkovskaya was murdered in 2006, deepening cynicism about violence and impunity in Russia. This intensified cynicism and moral revulsion, making harsher and more sarcastic moods feel more natural."
2006,St Petersburg hosts the G8 summit,"The 2006 G8 summit in St Petersburg projected an image of Russia as a confident global power. This fed triumphant and celebratory moods and favored songs built around confidence, spectacle, and collective feeling."
2006,Dima Bilan's Eurovision run becomes a national TV event,"Dima Bilan's Eurovision run became a national television event. It reinforced the value of polished, emotional spectacle in mainstream Russian pop."
2006,Russia's anti-Georgian campaign strains cultural exchange,Russia's anti-Georgian campaign strained cultural exchange in 2006. The atmosphere narrowed the emotional ease of post-Soviet cultural mixing.
2006,Twitter launches,Twitter launched. Faster public feedback loops began pushing music culture toward immediacy and reactive emotion.
2006,Alexander Litvinenko is poisoned in London,Alexander Litvinenko was poisoned in London. The spy-thriller atmosphere deepened public suspicion and noir-like emotional coloring.
2006,Global ringtone business peaks and starts to crack,The global ringtone business peaked and began to crack. That transition prepared the move from tiny song fragments toward fuller digital listening again.
2007,Global credit crisis begins,"The global credit crisis began. This deepened social stress and economic insecurity, often favoring bleak, ironic, and survival-oriented moods in music."
2007,Radiohead releases In Rainbows,"Radiohead released In Rainbows. This gave Soviet and Russian listeners a fresh emotional model, and its sound spread through broadcasts, imports, and home copying."
2007,Serebro places third at Eurovision,"The group Serebro represented Russia at Eurovision 2007 and finished third. This amplified shared cultural energy and rewarded brighter, bigger, and more communal musical moods."
2007,Start of the smartphone music era,"Mobile internet and smartphones began reshaping music consumption. This changed how songs were discovered and shared, helping new moods and styles spread faster than before."
2007,Parliamentary election reinforces managed stability,"The 2007 parliamentary election reinforced the atmosphere of managed stability that dominated late-2000s state media. This sharpened questions of identity and belonging, making music more sensitive to symbolic loyalty and cultural division."
2007,Russia wins the right to host the 2014 Winter Olympics,Russia won the right to host the 2014 Winter Olympics in Sochi. The victory fed ambitious and triumphant public moods that also favored spectacle in pop culture.
2007,Apple releases the iPhone,Apple released the iPhone. The device accelerated always-on listening and made music feel even more intimate and constant.
2007,Britney Spears' breakdown dominates tabloid culture,Britney Spears' public breakdown dominated tabloid culture. The spectacle made pop stardom look fragile and emotionally unstable rather than purely glamorous.
2007,Kanye West releases Graduation,"Kanye West released Graduation. Its glossy, melodic rap helped pull youth taste toward a brighter and more maximalist urban sound."
2007,Mortgage-market collapse shakes confidence,The mortgage-market collapse began to shake global confidence. The shift weakened carefree consumer moods and prepared a turn toward anxiety.
2008,Dima Bilan wins Eurovision for Russia,"Dima Bilan won the Eurovision Song Contest for Russia. This amplified shared cultural energy and rewarded brighter, bigger, and more communal musical moods."
2008,Russia and Georgia fight five day war,"Russia and Georgia fought a five-day war in August 2008. This pushed music toward darker, more anxious, and more fatalistic moods while making patriotic and protest impulses more intense."
2008,Spotify opens to the public in Europe,"Spotify opened to the public in Europe. This changed how songs were discovered and shared, helping new moods and styles spread faster than before."
2008,Global financial crisis hits Russia,"The global financial crisis hit Russia in 2008 and abruptly ended the easy optimism of the oil-boom years. This deepened social stress and economic insecurity, often favoring bleak, ironic, and survival-oriented moods in music."
2008,Premiere of Stilyagi,"Valery Todorovsky's film Stilyagi premiered in 2008 and turned retro youth nonconformism into a vivid pop spectacle. This amplified shared cultural energy and rewarded brighter, bigger, and more communal musical moods."
2008,Egor Letov dies,Egor Letov died. His death turned Russian punk memory into a public mourning space and strengthened the prestige of raw emotional honesty.
2008,App Store launches,Apple's App Store launched. It accelerated mobile listening habits and made music discovery more app-driven and personalized.
2008,Beijing Olympics opening ceremony becomes a global spectacle,"The Beijing Olympics opening ceremony became a global spectacle. Its scale reinforced appetite for highly choreographed, emotionally legible mass performance."
2008,South Ossetia and Abkhazia are recognized by Russia,Russia recognized South Ossetia and Abkhazia after the war. The step prolonged geopolitical tension and kept public feeling defensive and brittle.
2008,Slumdog Millionaire soundtrack becomes a global crossover,The Slumdog Millionaire soundtrack became a global crossover success. Its ecstatic blend of styles supported a brief countercurrent of joy during the crisis year.
2009,Eurovision Song Contest is hosted in Moscow,"The Eurovision Song Contest was hosted in Moscow. This amplified shared cultural energy and rewarded brighter, bigger, and more communal musical moods."
2009,Growth of independent online music release in Russia,"By 2009, Russian artists were increasingly using social networks and online platforms for direct music release and promotion. This gave musicians more room to experiment and strengthened hopeful, searching, and forward-looking moods."
2009,VKontakte music listening becomes a mass youth practice in Russia,"By 2009, listening to and sharing music through VKontakte had become a mass practice among Russian youth. This changed how songs were discovered and shared, helping new moods and styles spread faster than before."
2009,Perm nightclub fire,"The fire at the Lame Horse nightclub in Perm in 2009 became one of modern Russia's deadliest entertainment-space disasters. This encouraged more mournful and reflective tones and made fragile, grief-struck songs feel more immediate."
2009,Medvedev's modernization agenda peaks,"Dmitry Medvedev's modernization rhetoric peaked in 2009 and briefly encouraged a more future-oriented public vocabulary. This strengthened forward-looking, searching, and transitional moods in the music field."
2009,Michael Jackson dies,Michael Jackson died. The scale of mourning made pop memory itself a central emotional event of the year.
2009,Lady Gaga's rise changes pop theatrics,Lady Gaga's rise changed pop theatrics worldwide. Her stylized emotional excess encouraged Russian performers to chase stronger mood and image contrasts.
2009,Nevsky Express bombing revives terror anxiety,The Nevsky Express bombing revived terror anxiety in Russia. The attack reinforced fear in everyday mobility and public space.
2009,H1N1 pandemic spreads uncertainty,The H1N1 pandemic spread uncertainty across the world. The health scare encouraged a more cautious and fragile emotional climate.
2009,Avatar becomes a global escapist event,Avatar became a global escapist event. Its immersive spectacle rewarded dreamier and more transportive popular moods.
2010,Growth of internet-native Russian indie music,"Internet-native Russian indie music grew rapidly. This gave musicians more room to experiment and strengthened hopeful, searching, and forward-looking moods."
2010,Yandex Music launches in Russia,"Yandex Music launched in Russia. This changed how songs were discovered and shared, helping new moods and styles spread faster than before."
2010,Kanye West releases My Beautiful Dark Twisted Fantasy,"The album became a benchmark for 2010s mainstream album production. This gave Soviet and Russian listeners a fresh emotional model, and its sound spread through broadcasts, imports, and home copying."
2010,Russian heatwave and wildfires,"The 2010 heatwave and wildfires created a summer of exhaustion, smoke, and ecological anxiety across Russia. This encouraged more mournful and reflective tones and made fragile, grief-struck songs feel more immediate."
2010,Manezhnaya Square riots,"The Manezhnaya Square riots in Moscow in late 2010 exposed rising nationalist anger among Russian youth. This made harsher, confrontational, and more socially irritated moods feel more immediate in music."
2010,Moscow metro bombings renew urban fear,Bombings in the Moscow metro renewed urban fear. The attacks made tense and mournful emotional tones feel more immediate in Russian public life.
2010,Instagram launches,Instagram launched. The visual turn strengthened mood-based branding and made music feel more tied to shareable atmosphere.
2010,Love Parade disaster shocks youth festival culture,The Love Parade disaster shocked youth festival culture in Europe. It brought grief and vulnerability into spaces previously associated mainly with collective euphoria.
2010,WikiLeaks leaks redefine online political tone,The WikiLeaks leaks redefined online political tone. The rawness of disclosure intensified cynicism and sharpened the appetite for confrontational expression.
2010,Linkin Park releases A Thousand Suns,Linkin Park released A Thousand Suns. Its anxious electronic scale matched the era's sense of technological overload and instability.
2011,Partial shift of Russian hip-hop toward independent online release,"By the early 2010s, Russian hip-hop artists were increasingly using online releases and social platforms outside traditional label structures. This gave musicians more room to experiment and strengthened hopeful, searching, and forward-looking moods."
2011,Spotify launches in the United States,"Spotify launched in the United States. This changed how songs were discovered and shared, helping new moods and styles spread faster than before."
2011,Bolotnaya protest wave begins,"Mass protests against electoral fraud began in late 2011 and transformed the political atmosphere of urban Russia. This made confrontational and socially charged tones feel more relevant in rock, rap, and singer-songwriter music."
2011,Lokomotiv Yaroslavl plane crash,"The Lokomotiv Yaroslavl plane crash killed most of the hockey team in 2011 and became a national tragedy. This encouraged more mournful and reflective tones and made fragile, grief-struck songs feel more immediate."
2011,Pussy Riot is formed,"The feminist punk-art group Pussy Riot was formed in 2011 and quickly became a lightning rod for culture-war conflict. This made confrontational and socially charged tones feel more relevant in rock, rap, and singer-songwriter music."
2011,Arab Spring changes protest aesthetics worldwide,"The Arab Spring changed protest aesthetics worldwide. It made songs of public gathering, hope, and volatility feel newly central to youth culture."
2011,Amy Winehouse dies,Amy Winehouse died. Her death deepened the association between confessional pop and personal collapse.
2011,Apple launches iCloud,"Apple launched iCloud. The shift weakened attachment to owned collections and normalized more fluid, access-based listening."
2011,Occupy Wall Street spreads,Occupy Wall Street spread as a protest movement. Its language of inequality pushed music culture toward sharper social self-awareness.
2011,Muammar Gaddafi is overthrown and killed,Muammar Gaddafi was overthrown and killed. The violent end of a ruler reinforced the year's unstable and high-voltage emotional atmosphere.
2012,Buranovskiye Babushki take second at Eurovision,"Buranovskiye Babushki placed second at Eurovision. This amplified shared cultural energy and rewarded brighter, bigger, and more communal musical moods."
2012,Growth of battle rap and online hip-hop platforms in Russia,"By 2012, battle rap and online hip-hop platforms had become more visible in Russian youth culture. This gave musicians more room to experiment and strengthened hopeful, searching, and forward-looking moods."
2012,PSY releases Gangnam Style,"PSY released 'Gangnam Style'. This gave Soviet and Russian listeners a fresh emotional model, and its sound spread through broadcasts, imports, and home copying."
2012,Pussy Riot trial and conviction,"The trial and conviction of Pussy Riot in 2012 became a global symbol of the clash between protest art and the Russian state. This narrowed the range of acceptable themes and pushed musical expression toward coded bitterness, tension, or self-censorship."
2012,Foreign-agent and anti-protest laws tighten the climate,"A package of 2012 laws on foreign agents and protests tightened the climate for independent culture and civil society. This narrowed the range of acceptable themes and pushed musical expression toward coded bitterness, tension, or self-censorship."
2012,Madonna speaks out on Pussy Riot,Madonna publicly spoke out on Pussy Riot during her Moscow concert. That moment fused global pop stardom with Russian political conflict and heightened music's oppositional charge.
2012,Frank Ocean releases Channel Orange,Frank Ocean released Channel Orange. Its intimate emotional clarity strengthened the prestige of vulnerable and nuanced songwriting.
2012,London Olympics closing ceremony celebrates pop history,The London Olympics closing ceremony celebrated British pop history. The event turned collective music memory into a bright and unifying public mood.
2012,Russia passes the internet blacklist law,Russia passed the internet blacklist law. The law signaled that online cultural freedom would now face more direct control.
2012,May 6 clashes end the protest spring mood,The May 6 clashes in Moscow ended the protest spring mood. The shift pushed public feeling from hopeful mobilization toward anger and fatigue.
2013,Rise of trap and cloud rap,Trap and cloud rap rose to prominence. This reshaped commercial incentives and nudged artists toward sounds that matched newly visible audiences and emotions.
2013,Russia adopts anti LGBT propaganda law,"Russia adopted the law against 'LGBT propaganda' for minors. This narrowed the range of acceptable themes and pushed musical expression toward coded bitterness, tension, or self-censorship."
2013,Volgograd bombings,"The Volgograd bombings at the end of 2013 renewed the sense of terrorist threat in Russia. This created a climate of shock and vulnerability, making somber, tense, and security-focused moods more prominent."
2013,Euromaidan begins in Kyiv,"The Euromaidan protests in Kyiv began in 2013 and soon transformed the emotional and symbolic landscape of the whole region. This sharpened questions of identity and belonging, making music more sensitive to symbolic loyalty and cultural division."
2013,Traditional-values rhetoric moves deeper into state culture,"By 2013 state-backed traditional-values rhetoric had moved deeper into official cultural policy and media messaging. This sharpened questions of identity and belonging, making music more sensitive to symbolic loyalty and cultural division."
2013,Daft Punk release Random Access Memories,Daft Punk released Random Access Memories. Its glossy nostalgia made warmth and craft feel newly desirable against a harsher political backdrop.
2013,Russia adopts the anti-piracy law,"Russia adopted an anti-piracy law. The law showed that online culture was becoming more regulated, affecting how music circulated and felt."
2013,Biryulyovo riots expose urban ethnic tension,The Biryulyovo riots exposed urban ethnic tension in Moscow. The unrest intensified anger and made public culture more confrontational.
2013,Edward Snowden receives asylum in Russia,"Edward Snowden received asylum in Russia. The case amplified themes of surveillance, secrecy, and mistrust across digital culture."
2013,Beyoncé releases a surprise self-titled album,Beyoncé released a surprise self-titled album. The drop changed release strategy worldwide and made music consumption feel more event-driven and immediate.
2014,Crimea Annexation and Donbas War,"Russia annexed Crimea and war began in Donbas. This pushed music toward darker, more anxious, and more fatalistic moods while making patriotic and protest impulses more intense."
2014,Split of the Russian and Ukrainian music markets,The Russian and Ukrainian music markets began to split along political lines. This reshaped commercial incentives and nudged artists toward sounds that matched newly visible audiences and emotions.
2014,Sochi Winter Olympics,"The Sochi Winter Olympics in early 2014 were staged as a massive display of prestige and modern national image. This fed triumphant and celebratory moods and favored songs built around confidence, spectacle, and collective feeling."
2014,Ruble crash and sanctions recession,"The ruble crashed in late 2014 as sanctions and oil-price shocks pushed Russia into recession. This deepened social stress and economic insecurity, often favoring bleak, ironic, and survival-oriented moods in music."
2014,MH17 disaster deepens international rupture,"The destruction of flight MH17 in 2014 deepened Russia's international isolation and the moral shock surrounding the war. This intensified anxious, tense, and vulnerable moods around cultural life and listening."
2014,Russia passes a law limiting foreign ownership of media,Russia passed a law limiting foreign ownership of media. The move signaled a tighter information space and encouraged more cautious emotional coding in mainstream music.
2014,Russia's anti-piracy law is expanded,Russia expanded its anti-piracy law. The change showed that online cultural circulation would be watched more closely and become less carefree.
2014,Apple buys Beats,Apple bought Beats. The deal helped make streaming and mood-based curation feel like the future of mass listening.
2014,Conchita Wurst wins Eurovision,Conchita Wurst won Eurovision. The result intensified culture-war arguments in Russia and made music feel more openly tied to identity politics.
2014,Russia is suspended from the G8 after Crimea,Russia was suspended from the G8 after Crimea. The break with Western institutions reinforced siege-minded feeling and sharpened musical identity divides.
2015,Escalation of the Syrian war and refugee crisis,"The Syrian war escalated and the refugee crisis deepened. This pushed music toward darker, more anxious, and more fatalistic moods while making patriotic and protest impulses more intense."
2015,Kendrick Lamar releases To Pimp a Butterfly,"Kendrick Lamar released To Pimp a Butterfly. This gave Soviet and Russian listeners a fresh emotional model, and its sound spread through broadcasts, imports, and home copying."
2015,Russia starts military operation in Syria,"Russia began its military operation in Syria. This pushed music toward darker, more anxious, and more fatalistic moods while making patriotic and protest impulses more intense."
2015,Assassination of Boris Nemtsov,"Opposition politician Boris Nemtsov was assassinated near the Kremlin in 2015. This intensified cynicism and moral revulsion, making harsher and more sarcastic moods feel more natural."
2015,Sanctions recession and falling oil prices,"Sanctions recession and falling oil prices made 2015 feel poorer, tighter, and more constrained for many Russians. This deepened social stress and economic insecurity, often favoring bleak, ironic, and survival-oriented moods in music."
2015,Apple Music launches,Apple Music launched. Its arrival accelerated the move toward subscription listening and mood-based playlists.
2015,Russia adopts the law on 'undesirable organizations',Russia adopted the law on 'undesirable organizations'. The law deepened the sense of narrowing civic space and made cultural expression feel more guarded.
2015,Paris terrorist attacks shock Europe,The Paris terrorist attacks shocked Europe. The violence darkened public feeling and strengthened the pull of somber and protective moods in music.
2015,Zhanna Friske dies,Zhanna Friske died. Her death became a national mourning moment and briefly centered tenderness and grief in Russian pop memory.
2015,Adele releases Hello,"Adele released Hello. Its huge success restored mass prestige to longing, vulnerability, and direct emotional balladry."
2016,Adoption of the Yarovaya package,"Russia adopted the Yarovaya package of anti-terror laws. This created a climate of shock and vulnerability, making somber, tense, and security-focused moods more prominent."
2016,Oxxxymiron vs ST battle on Versus,"The battle between Oxxxymiron and ST on the Versus platform took place in 2016. This amplified shared cultural energy and rewarded brighter, bigger, and more communal musical moods."
2016,Russian doping scandal leads to Olympic limits,"International sports bodies imposed restrictions after the Russian doping scandal. This sharpened questions of identity and belonging, making music more sensitive to symbolic loyalty and cultural division."
2016,Mariinsky Orchestra concert in Palmyra,"A Mariinsky Orchestra concert in Palmyra in 2016 turned classical music into an explicit state-geopolitical symbol. This sharpened questions of identity and belonging, making music more sensitive to symbolic loyalty and cultural division."
2016,Deaths of David Bowie and Prince,"The deaths of David Bowie and Prince in 2016 hit a generation of Russian and global listeners who had grown up with their music. This triggered public mourning and strengthened the pull of elegiac, intimate, and memory-driven music."
2016,Panama Papers expand distrust of elites,The Panama Papers expanded distrust of elites worldwide. The disclosures intensified cynicism and sharpened the appeal of accusatory and skeptical artistic tones.
2016,Pokemon Go turns city life briefly playful,"Pokemon Go briefly turned city life more playful in many countries, including Russia. The fad provided a short-lived counterweight of curiosity and lightness to a tense period."
2016,Donald Trump is elected US president,Donald Trump was elected US president. The result deepened global polarization and made confrontation feel like the default emotional register.
2016,George Michael dies,George Michael died. His death closed another chapter of late-20th-century pop and triggered reflective nostalgia.
2016,Eurovision 2016 doubles down on high-concept staging,Eurovision 2016 doubled down on high-concept staging and spectacle. That reinforced the premium placed on instantly readable emotion and visual drama in pop.
2017,Despacito sets streaming records,"'Despacito' set global streaming records. This gave Soviet and Russian listeners a fresh emotional model, and its sound spread through broadcasts, imports, and home copying."
2017,Oxxxymiron vs Dizaster battle,"The battle between Oxxxymiron and Dizaster took place in Los Angeles in 2017. This amplified shared cultural energy and rewarded brighter, bigger, and more communal musical moods."
2017,Russia is blocked from Eurovision in Kyiv,"Russia's Eurovision entry was denied entry to Ukraine. This pushed music toward darker, more anxious, and more fatalistic moods while making patriotic and protest impulses more intense."
2017,Navalny-led youth protests,"A new wave of youth-heavy anti-corruption protests around Alexei Navalny changed the emotional temperature of urban Russia in 2017. This made confrontational and socially charged tones feel more relevant in rock, rap, and singer-songwriter music."
2017,Trap-heavy rap becomes chart mainstream,By 2017 trap-heavy rap had become a mainstream chart force in Russian-speaking youth culture. This reshaped commercial incentives and nudged artists toward sounds that matched newly visible audiences and emotions.
2017,Russia bans online anonymizers and VPN services,Russia moved to ban online anonymizers and many VPN services. The measure signaled tighter digital control and increased the emotional pressure toward self-censorship.
2017,Chester Bennington dies,Chester Bennington died. His death intensified the association between emotional candor in rock and personal vulnerability.
2017,Serebrennikov case shakes the cultural elite,"The Serebrennikov case shook Russia's cultural elite. It reminded artists that bold public work could carry legal risk, tightening the emotional climate."
